DESCRIPTION,CATEGORY,U/PRICE
"CLUTCH PUMP LOW WIRA, PERDANA 13/16``",Uncategorized,38.00
DOOR PIN 2 5/8``,Exterior & Accessories,2.00
"VALVE COVER HOSE WAJA, GEN 2, BLM (LONG)",Seals & Gaskets,15.00
"BREATHER HOSE GEN 2, PERSONA",Miscellaneous,20.00
PISTON RING KANCIL 850 STD (66.6MM),Uncategorized,80.00
"CON ROD BRG KANCIL 850, KLS, KNR, VIVA 850, MYVI 1.0 STD",Uncategorized,58.00
HEAD GSK KANCIL,Uncategorized,20.00
WATER HOSE TOP LH80,Miscellaneous,25.00
WATER HOSE LOW LH80,Miscellaneous,24.00
DOOR TRIM HICOM,Exterior & Accessories,130.00
DOOR INNER POCKET HICOM,Exterior & Accessories,18.00
DOOR INNER HANDLE HICOM,Exterior & Accessories,28.00
"OIL SEAL TIMING V99, 14B",Seals & Gaskets,32.00
WINDOW GEAR RH HICOM 2.8 4.3 (1TON-3TON),Uncategorized,70.00
WINDOW GEAR LH HICOM 2.8 4.3 (1TON-3TON),Uncategorized,70.00
"WATER PUMP 3L, LH80, LN106, LY100, LH113",Cooling System,85.00
FAN BELT 17X1200,Belts & Timing,26.00
WATER HOSE TOP V57,Miscellaneous,20.00
"WATER HOSE TOP V99, V116",Miscellaneous,20.00
BULB 4038 12V,Exterior & Accessories,1.00
"BEARING FW WIRA, SATRIA",Uncategorized,40.00
"OIL CAP O RING GEN 2, PERSONA (SILICONE)",Seals & Gaskets,4.00
LITHIUM EP BEARING GREASE Z2 (GOLD) 0.5KG,Miscellaneous,25.00
"FAN BELT TENSIONER GEN 2, PERSONA, BLM",Belts & Timing,110.00
ENG MTG RH N16,Uncategorized,75.00
BULB 1016 24V,Exterior & Accessories,2.00
FAN BELT TENSIONER,Belts & Timing,420.00
FAN BELT PULLEY,Belts & Timing,95.00
COUPLING 16MM,Uncategorized,36.00
EXH PIPE GSK WIRA (CTR),Miscellaneous,7.00
"OIL FILTER TRITON 2.5, PAJERO, STORM (SMALL LONG)",Filters,48.00
"OIL FILTER T3000, T4000, HINO 1-5TON (FO-2250)",Filters,16.00
FUEL FILTER MAXI,Filters,16.00
TOP SET GSK T3500 SL,Uncategorized,150.00
"BRAKE PUMP RR C22, Y10 3/4``",Brake Components,27.00
"BRAKE SHOE RR C22, Y10",Brake Components,60.00
SIDE MIRROR LH KLS (ATM),Exterior & Accessories,65.00
"D/S BOOT WAJA 1.6, GEN 2 (IN)",Uncategorized,15.00
"ENG MTG SET WAJA 1.6, GEN 2 (MTM) (1 YEAR WARRANTY)",Uncategorized,215.00
"DISC PAD RR ACV30, WISH",Brake Components,110.00
"WHEEL BOLT P/SG, WIRA (SHORT) M14X12X1.5MX45L",Miscellaneous,5.00
"WHEEL NUT LN166, KUN25, SXV10, VIOS (CHROME)",Miscellaneous,7.00
"TIE ROD END P/SG, WIRA, WAJA, GEN 2",Suspension & Mountings,32.00
BRAKE BOOSTER NHR,Brake Components,180.00
"OIL SEAL KIT RW V58, V99 (70X112X14/20, 55X101X4.7)",Seals & Gaskets,23.00
"LOWER ARM RH KLS, KNR (6 MONTHS WARANTY)",Suspension & Mountings,50.00
"LOWER ARM LH KLS, KNR (6 MONTHS WARRANTY)",Suspension & Mountings,50.00
"LOWER ARM BUSH FRT KLS, KNR (CTR)",Suspension & Mountings,5.00
"AXLE WASHER RR V26, V58, V99",Suspension & Mountings,7.00
SPRING BUSH HICOM 4.3 (LONG) 18MM,Suspension & Mountings,65.00
"ALT PIPE LH80, LN106",Miscellaneous,26.00
ALT HOSE LH80 (D),Miscellaneous,15.00
BRAKE SHOE RR RANGER,Brake Components,105.00
"BRAKE PUMP RR RANGER (O), RANGER T6, BT50 15/16``",Brake Components,38.00
DRIVE SHAFT RH WIRA 1.5 (SHORT),Uncategorized,160.00
"PWR STG PUMP KUN25, KUN26",Uncategorized,300.00
TAIL LAMP LH GUN125,Exterior & Accessories,220.00
"OIL SEAL D/S KLS, KNR, MYVI, VIVA, ALZA, AXIA (LH)",Seals & Gaskets,12.00
"CLIP FENDER PRO P/SG, WIRA",Miscellaneous,1.00
"THROTTLE BODY HOSE MYVI, ALZA",Miscellaneous,15.00
"OIL FILTER 120Y, B11, C22",Filters,10.00
ABS FRT & RR HICOM 2.8 SAFARI,Brake Components,150.00
"STEP BOARD LH V57, LH80",Uncategorized,22.00
"RACK END KLS, KNR, SUTERA",Uncategorized,24.00
"TIE ROD END KANCIL, KLS, KNR, G11, VIVA",Suspension & Mountings,33.00
WATER HOSE TOP WIRA INJ,Miscellaneous,17.00
RAD COOLANT PROTON 4L (BLUE),Engine Oils & Fluids,50.00
"THERMOSTAT P/SG, WIRA 1.5",Cooling System,22.00
"BEARING PINION GEAR LN166, KUN25 (S)",Uncategorized,110.00
"BEARING D/S KUN25, INNOVA (43X80X17) 90363-T0014",Uncategorized,95.00
NEEDLE BRG KUN25,Uncategorized,55.00
"ABS MTG F/LH LATIO, LIVINA, SYLPHY",Brake Components,65.00
"AUTO FILTER T9A, T7A, BRV, T5A, TEA 1.8 (SMALL)",Uncategorized,45.00
LOWER ARM LH KEMBARA,Suspension & Mountings,95.00
LOWER ARM RH KEMBARA,Suspension & Mountings,95.00
"TIMING KIT SET KBR, S89, RUSA 1.3",Uncategorized,145.00
"PLUG O RING S89, KBR, RUSA, KLS, S9A, SDA, SO4, S5A",Uncategorized,6.00
"VALVE COVER GSK S89, KBR, RUSA",Seals & Gaskets,15.00
"OIL PAN SEAL S89, RUSA, KBR (SET)",Seals & Gaskets,18.00
FAN BELT KEMBARA,Belts & Timing,35.00
"FAN BELT WIRA 1.6, KEMBARA, SWIFT 1.4 (ALT)",Belts & Timing,18.00
FUEL FILTER P/SG (F),Filters,5.00
ABS BUSH 0451 (4554 ABS BUSH),Brake Components,2.00
THROTTLE BODY GSK WIRA 1.5 (52MM),Uncategorized,3.00
DOOR CABLE FRT VIVA (OPEN),Exterior & Accessories,15.00
STOPPER 22MM,Uncategorized,3.00
"BRAKE BOOSTER HOSE P/SG, WIRA (VALVE)",Brake Components,25.00
SPRING WASHER M10 (3/8``),Suspension & Mountings,0.50
NUT 3/8``,Miscellaneous,0.50
"H/B CABLE R/RH KUN25, KUN26 (2DOOR=4DOOR)",Exterior & Accessories,75.00
"H/B CABLE R/LH KUN25, KUN26 (2DOOR=4DOOR)",Exterior & Accessories,75.00
ENG MTG FRT WIRA (ATM),Uncategorized,26.00
FAN BELT VIVA (P/STG) 3PK525,Belts & Timing,15.00
FAN BELT 9.5X740 VIVA,Belts & Timing,10.00
"FAN BELT KLS, KNR, VIVA, MYVI 1.0 (ALT) 4PK715",Belts & Timing,22.00
BULB H3 12V 55W,Exterior & Accessories,12.00
GEAR OIL LUBRIMAXX  SAE90 GL4 4L,Engine Oils & Fluids,65.00
METER CABLE WIRA 1.3 1.5,Uncategorized,32.00
FUEL HOSE 7MM,Miscellaneous,3.00
"BEARING PINION GEAR LN106, HZJ80",Uncategorized,60.00
"COUPLING PAJERO, CANTER, V99 (30X86)",Uncategorized,55.00
"OIL SEAL RW LN106, LN166, LH80, KUN25 (O) (IN)",Seals & Gaskets,8.00
TIE ROD END PAJERO (OUT),Suspension & Mountings,70.00
WATER JACKET 28MM,Uncategorized,2.00
WATER JACKET 19MM,Uncategorized,2.00
WATER JACKET 18MM,Uncategorized,2.00
"COIL SPRING RUBBER RR ALZA, KANCIL, MYVI, VIVA, G11 (STD) (LOW)",Suspension & Mountings,8.00
"CLUTCH PUMP LOW ALZA, MYVI LB 3/4``",Uncategorized,90.00
AIR FILTER NPR 4JJ1,Filters,130.00
TAIL GATE HANDLE KUN25 G,Exterior & Accessories,230.00
BMC YU41 1 1/16`` (2 BOLT HOLE),Miscellaneous,190.00
o ring,Uncategorized,1.00
ABS F/RH WIRA 1.5 (OIL),Brake Components,105.00
DRIVE SHAFT LH WIRA 1.5 (LONG),Uncategorized,160.00
AIR COND MOTOR WIRA (ND),Uncategorized,65.00
LOWER ARM RH WIRA,Suspension & Mountings,70.00
LOWER ARM LH WIRA,Suspension & Mountings,70.00
HINO VALVE COVER BUSH G,Suspension & Mountings,45.00
AXLE SHAFT COVER CANTER 3TON 4X4,Suspension & Mountings,95.00
BULB 1141 12V,Exterior & Accessories,1.00
BRAKE PIPE RR KUN25,Brake Components,30.00
"OIL FILTER N16, C24, TEANA, ALMERA",Filters,10.00
NUT M10 X 1.25M,Miscellaneous,0.50
D/S BOOT PJR V6 (IN=OUT),Uncategorized,16.00
STAB BUSH FRT PJR V6 (27MM),Suspension & Mountings,10.00
WATER PUMP PIPE AVANZA W/RAD CORK 16035-97401,Cooling System,28.00
"BEARING FLY LN106, KUN25, V57",Uncategorized,12.00
"OIL SEAL MAIN PAJERO, V6, TRITON",Seals & Gaskets,20.00
BRAKE FLUID DOT 3 (BIG),Engine Oils & Fluids,12.00
"BRAKE PUMP RR GEN 2, PERSONA",Brake Components,30.00
OIL SWITCH P/SG,Electrical Components,18.00
GRILLE FRT KNR 03`,Uncategorized,90.00
BUMPER RR KANCIL 99`,Uncategorized,95.00
"AXLE STUD SLEEVE FRT LN65, LN106 (8MM)",Suspension & Mountings,2.00
"AXLE STUD SPRING WASHER FRT LN65, LN106 (8MM)",Suspension & Mountings,0.50
"LOWER ARM LH LATIO, LIVINA, SYLPHY (6 MONTHS WARRANTY)",Suspension & Mountings,120.00
"RACK END LATIO, LIVINA, TEANA, SYLPHY, NV200",Uncategorized,68.00
D/S BOOT IN SYLPHY,Uncategorized,18.00
"ABS LINK FRT LIVINA, LATIO",Brake Components,34.00
DOOR GLASS MLDG F/LH MYVI 05`~08`,Exterior & Accessories,25.00
DOOR GLASS MLDG R/RH MYVI 05`~08`,Exterior & Accessories,25.00
DOOR GLASS MLDG R/LH MYVI 05`~08`,Exterior & Accessories,25.00
"WIPER BLADE WAJA, GEN 2, PDN, KUN25, KUN26, HINO 1-3TON",Exterior & Accessories,22.00
"CVTF OIL HONDA HCF-2 3.5L (T9A, HRV, T5A, T7A,RC1)",Uncategorized,175.00
"GEAR LEVEL BUSH LASER, RANGER (LOW) WHITE",Suspension & Mountings,2.00
"CVTF OIL HONDA 3.5 LITRES (SEL IDSI, VTEC, CRZ)",Uncategorized,150.00
"BY PASS HOSE KLS, KNR (SHORT)",Miscellaneous,6.00
PLUG CABLE P/SG 12V,Ignition Components,26.00
OIL SEAL KIT FW KUN25 (72.5X89.5X7.4/16 & 80X96X10/18),Seals & Gaskets,30.00
RELAY 5 PIN,Electrical Components,12.00
"STG BOOT KLS, KNR, MYVI, VIVA, ALZA",Uncategorized,13.00
"D/S BOOT SM4, SV4, RIA (IN)",Uncategorized,15.00
"STG BOOT SR4, SO4, SX8, S10",Uncategorized,15.00
"D/S BOOT SO4, SX8 (IN)",Uncategorized,13.00
D/S BOOT P/SG (IN/OUT),Uncategorized,12.00
"D/S BOOT KUN25, GUN125 (IN)",Uncategorized,22.00
BRAKE SHOE RR P/SG 12V,Brake Components,38.00
BRAKE PUMP RR P/SG 12V 3/4``,Brake Components,18.00
DRIVE SHAFT KUN25 L=R,Uncategorized,300.00
OIL SEAL FW PAJERO,Seals & Gaskets,18.00
AIR COND PULLEY KIT 6203,Uncategorized,28.00
"RADIATOR BUSH TOP KANCIL, MYVI, VIVA",Cooling System,3.00
ENG OIL LUBRIMAXX ULTRA LIGHT 10W30 SM/CF 3 LITRES,Engine Oils & Fluids,50.00
"VALVE COVER GSK SEL VTEC, JAZZ 1.5",Seals & Gaskets,28.00
"LOWER ARM LH MYVI, MYVI LB (6 MONTH WARRANTY)",Suspension & Mountings,85.00
"LOWER ARM RH MYVI, MYVI LB",Suspension & Mountings,65.00
"LOWER ARM LH MYVI, MYVI LB",Suspension & Mountings,65.00
"DOOR HINGE KANCIL RH TOP, LH LOW (FRT=RR)",Exterior & Accessories,27.00
"DOOR HINGE KANCIL LH TOP, RH LOW (FRT=RR)",Exterior & Accessories,27.00
"OIL SEAL D/S WAJA, MATRIX 1.8, GEN 2, PSN, BLM (ATM), NEO",Seals & Gaskets,15.00
COPPER SPRAY,Uncategorized,37.00
TOP SET GSK WIRA 1.6,Uncategorized,110.00
"ABS FRT NPR , HICOM (H.D)",Brake Components,180.00
"AIR FILTER V57, LN106, STORM, PJR 2.8 (TURBO) 17801-87303",Filters,22.00
ENG OIL LUBRIMAXX M1 SPECIAL 10W40 1 LITRE,Engine Oils & Fluids,35.00
"CLIP BUMPER, GRILLE MYVI, AVANZA",Miscellaneous,1.50
"ALIGHTMENT BOLT RR WIRA, WAJA, GEN 2, PSN",Exterior & Accessories,14.00
"RACK END WIRA, WAJA, GEN 2, PSN",Uncategorized,26.00
"DISC PAD RR WAJA 1.6, S40, SMART FORFOUR",Brake Components,66.00
"AUTO FILTER SET P/SG 12V, WIRA 1.6",Uncategorized,15.00
D/S BOOT NEO (IN),Uncategorized,15.00
"DOOR OUTER HANDLE F/RH KANCIL 94`, KBR",Exterior & Accessories,8.00
"DOOR OUTER HANDLE R/LH KANCIL 94`, KBR",Exterior & Accessories,8.00
BRAKE PUMP R/LH V57 1 1/8`` (NO ADJ),Brake Components,45.00
"BEARING FW WAJA, GEN 2, PSN, EXORA",Uncategorized,55.00
"ABS MTG FRT WAJA, GEN 2 , NEO, PSN",Brake Components,50.00
BRAKE PUMP F/RH V57 1 1/4`` (ADJ),Brake Components,45.00
"OIL FILTER O RING KLS, KNR, MYVI, AVANZA (1 BIG, 1 SMALL)",Filters,15.00
STAB BUSH FRT KANCIL 850 (22MM),Suspension & Mountings,6.00
"TIMING KIT SET KLS, KNR, MYVI 1.0, KANCIL 850 02`, VIVA 850 1.0",Uncategorized,130.00
"D/S BOOT KANCIL (OUT=IN), KLS, KNR (OUT)",Uncategorized,10.00
WIPER JOINT (Y) LONG,Suspension & Mountings,1.00
"WATER PUMP P/SG, ACCENT, GETZ 1.3",Cooling System,50.00
"VALVE COVER GSK P/SG 12V, WIRA 1.5",Seals & Gaskets,7.00
FAN BELT WIRA 1.5 (P/STG),Belts & Timing,15.00
"FAN BELT 13X760 P/STG FRONTIER D22, V58",Belts & Timing,11.00
OIL SEAL GEAR BOX PJR (TRANSFER) VITON,Seals & Gaskets,25.00
"OIL SEAL GEAR LEVEL PJR, STG C23",Seals & Gaskets,8.00
SPRING BUSH KUN25 (LONG),Suspension & Mountings,12.00
RACK END GUN125,Uncategorized,90.00
ENG OIL LUBRIMAXX M1 SPECIAL PLUS 10W40 SM/CF 4 LITRES,Engine Oils & Fluids,105.00
"AUTO FILTER SNA, SDA, S7A,TMO",Uncategorized,50.00
"AIR FILTER TMO, TFO, FREED",Filters,28.00
"AIR FILTER KLS, KNR",Filters,15.00
"BRAKE PUMP F/LH CANTER FB300, FB511 (1 1/4``) (ADJ)",Brake Components,48.00
OIL FILTER CANTER FB300,Filters,12.00
"OIL SEAL CAM SR4 T/C, CRV (VITON)",Seals & Gaskets,22.00
HYDRAULIC OIL LUBRIMAXX AW68 18 LITRES,Uncategorized,180.00
"BEARING CONE RW KUN25 08`, GUN125 (42X58)",Uncategorized,18.00
BUMPER FRT KANCIL 99`,Uncategorized,85.00
REFLECTOR RED & YELLOW 150MM X 600MM (DIAMOND) W/SIRIM,Uncategorized,70.00
CLIP HEAD LAMP (S),Miscellaneous,1.00
AXLE BUSH KIT P/SG,Suspension & Mountings,33.00
"STAB BUSH FRT EXORA, PREVE (24MM)",Suspension & Mountings,8.00
"BEARING CLUTCH N13, B14, Y10, BLM",Uncategorized,65.00
"VALVE COVER GSK BLM, FLX, PSN, EXR BOLD, PREVE (SILICON)",Seals & Gaskets,20.00
"BEARING ABS MTG FRT MYVI, VIVA, AXIA",Brake Components,15.00
EXH PIPE GSK NHR (63X53),Miscellaneous,5.00
FAN BELT KUN25 (7PK1516),Belts & Timing,75.00
"CYL HEAD PIPE GEN 2, BLM, PSN (28MM)",Miscellaneous,15.00
ENG MTG SET MYVI (MTM),Uncategorized,250.00
"GEAR LEVEL BOOT P/SG, WIRA, GEN 2",Uncategorized,6.00
"RADIATOR WIRA 1.6 ATM=MTM CT2 PA22/PA26 (WIRA 1.5, PERDANA ATM)",Cooling System,220.00
VITARA V6 WATER PUMP,Cooling System,130.00
ATF OIL PROTON SP-III 1 LITRE,Engine Oils & Fluids,30.00
VACCUM HOSE 3.5MM,Miscellaneous,2.00
DISC PUMP SEAL FRT WIRA 1.5,Seals & Gaskets,18.00
DRIVE SHAFT RH KANCIL (LONG),Uncategorized,135.00
"OIL FILTER YU41, 160J (SHORT)",Filters,13.00
GREASE SPRAY HARDEX 400ML,Miscellaneous,17.00
LOWER ARM LH AXIA (6 MONTHS WARRANTY),Suspension & Mountings,110.00
"STAB BUSH FRT BEZZA, AXIA (21MM)",Suspension & Mountings,7.00
PLUG CABLE WAJA 1.6,Ignition Components,33.00
H/B CABLE FRT WIRA 1.5,Uncategorized,20.00
CLUTCH KIT SET V57 (9 1/2``),Uncategorized,340.00
BEARING CLUTCH V57,Uncategorized,85.00
ABS FRT D-MAX 08`,Brake Components,170.00
"BALL JOINT TOP TRP V6, D-MAX 05`",Suspension & Mountings,80.00
TIE ROD END D-MAX 2.5 RT50 12`,Suspension & Mountings,95.00
RACK END D-MAX,Uncategorized,60.00
"BEARING FW TRP, D-MAX, KIA CERES",Uncategorized,45.00
"BEARING FW TROOPER V6, D-MAX",Uncategorized,52.00
BRAKE PUMP R/RH KEMBARA 13/16``,Brake Components,35.00
BRAKE PUMP R/LH KEMBARA 13/16`` (ADJ),Brake Components,35.00
"TIE ROD END KDH200, TRH200",Suspension & Mountings,125.00
TIE ROD END MYVI 05`,Suspension & Mountings,35.00
"CLUTCH KIT SET P/SG, WIRA 1.5 7.5``",Uncategorized,145.00
OIL SEAL TIMING VITARA V6,Seals & Gaskets,20.00
FUEL HOSE 6MM,Miscellaneous,2.50
"AIR HOSE GROMMET ALZA, MYVI, MYVI LB, MYVI ICON",Miscellaneous,6.00
"ABS COVER FRT WIRA 1.6, WAJA",Brake Components,7.00
"ABS COVER RR WIRA, WAJA",Brake Components,7.00
"COIL SPRING SEAT FRT WIRA 1.6, WAJA, GEN 2",Suspension & Mountings,25.00
"AIR FILTER KUN25, INNOVA",Filters,130.00
AIR FILTER KDH200 (NEW),Filters,38.00
"BEARING FW BLM, SAVVY, AVEO",Uncategorized,60.00
"ABS LINK F/RH NAVARA D23, NP300",Brake Components,35.00
FAN BELT NAVARA D23T (7PK1750),Belts & Timing,78.00
CABLE TIE 12``,Uncategorized,0.16
"AIR FILTER GUN125, GGN155",Filters,40.00
"ENG VALVE EX KE70, KM36, UNSER KF80",Uncategorized,15.00
"DISC PAD FRT LN106, LN166, KDN165, LJ79, LJ95",Brake Components,55.00
WATER HOSE LOW VIOS NCP42,Miscellaneous,23.00
"VALVE SEAL SR4, SM4, SO4, SV4, B16A (IN)",Seals & Gaskets,12.00
"VALVE SEAL SR4, SM4, SO4, SV4, B16A (EX)",Seals & Gaskets,12.00
"ABS MTG BUSH RR WIRA, WAJA, BLM (2 PCS)",Brake Components,6.00
"ARM RR WAJA, GEN 2, PSN L=R (SHORT)",Suspension & Mountings,38.00
DISC PUMP SEAL RR TX5,Seals & Gaskets,18.00
"ABS LINK FRT TMO, TFO 51320-TFO-003",Brake Components,35.00
"PLUG O RING WIRA 1.6, PERDANA 2.0, PJR V31 4G64",Uncategorized,5.00
VALVE COVER GSK WIRA 1.6,Seals & Gaskets,12.00
"TIMING CHAIN COVER O RING MYVI 1.3, KBR DVVT (3 HOLE)",Uncategorized,15.00
STG BOOT P/SG (M),Uncategorized,11.00
ENG MTG SET NCP42 G,Uncategorized,380.00
"LOWER ARM LH WAJA, GEN 2, PSN (6 MONTHS WARRANTY)",Suspension & Mountings,90.00
LOWER ARM FRT KANCIL L=R,Suspension & Mountings,35.00
"AIR FILTER ALTIS 1.6 1.8, WISH, CALDINA",Filters,20.00
"DISC PAD FRT VIOS NCP42, ALTIS 01`-08`",Brake Components,70.00
TIMING KIT SET KANCIL 850,Uncategorized,120.00
WATER PUMP KANCIL,Cooling System,70.00
"WATER HOSE TOP KANCIL, L5",Miscellaneous,12.00
"WATER HOSE LOW KANCIL, L5",Miscellaneous,15.00
BY PASS HOSE KANCIL (1SET=5PCS),Miscellaneous,25.00
WATER PUMP PIPE KANCIL,Cooling System,25.00
3 WAY PIPE KANCIL,Miscellaneous,6.00
4 WAY PIPE KANCIL,Miscellaneous,6.00
VALVE COVER GSK KANCIL,Seals & Gaskets,10.00
VALVE COVER BUSH KANCIL,Suspension & Mountings,4.00
"ABS FRT KUN25, KUN26, FORTUNER, GUN125, GUN126, GUN135 09K60,09J90,09440",Brake Components,130.00
DRIVE SHAFT RH KANCIL 850 (ATM) LONG,Uncategorized,180.00
DRIVE SHAFT LH KANCIL 850 (ATM) SHORT,Uncategorized,180.00
"STAB BUSH FRT BLM, SAVVY (19MM)",Suspension & Mountings,6.00
"ABS F/LH VIOS NCP93, PRIUS C",Brake Components,140.00
ABS LINK FRT VIOS NCP93,Brake Components,35.00
ABS COVER FRT VIOS NCP93 (TOP),Brake Components,20.00
"ABS BUSH FRT SXV10, SXV20, ACV30, VIOS NCP42, RR ACV40",Brake Components,12.00
"LOWER ARM RH VIOS NCP93 , YARIS (6 MONTHS WARRANTY)",Suspension & Mountings,135.00
"LOWER ARM LH VIOS NCP93 , YARIS (6 MONTHS WARRANTY)",Suspension & Mountings,135.00
TIE ROD END VIOS NCP93,Suspension & Mountings,70.00
ABS MTG FRT VIOS NCP93 (RUB),Brake Components,40.00
OIL SEAL ATM TEANA 2.5 V6 (51X66X7),Seals & Gaskets,35.00
"OIL SEAL FLY LATIO 1.6 1.8, LIVINA1.6 1.8, ALMERA N17 (84X117X8.5)",Seals & Gaskets,85.00
THERMOSTAT HOUSING SYLPHY,Cooling System,110.00
"OIL SEAL TIMING X-TRAIL T30, C26 (46X58X7)",Seals & Gaskets,25.00
VALVE COVER GSK TRITON 2.5 KB4,Seals & Gaskets,45.00
NOZZLE SEAL TRITON (B) 26X43X9,Seals & Gaskets,28.00
NOZZLE SEAL TRITON (S),Seals & Gaskets,28.00
"ALT MYVI 1.3, AVANZA1.3, KBR DVVT (3PIN)",Uncategorized,190.00
FAN BELT MYVI 1.3 (4PK1705),Belts & Timing,30.00
FAN BELT KEMBARA DVVT,Belts & Timing,40.00
PLUG O RING TRITON (IN),Uncategorized,13.00
U BOLT 6`` V57 (14X72X155),Miscellaneous,15.00
"FAN MOTOR ACR50, ANH20 (RH) W/WIRE",Uncategorized,220.00
COOLANT TCL(GREEN) 2 LITER,Engine Oils & Fluids,30.00
MAP SENSOR SR4,Electrical Components,200.00
"WHEEL NUT PERDANA, VIOS, KUN25 (CHROME)",Miscellaneous,7.00
BEARING CLUTCH KANCIL,Uncategorized,45.00
"OIL SEAL ATM P/SG, WIRA, WAJA, PERDANA, GEN 2, PSN, CITRA, NAZA RIA, TRITON, CARNIVAL 02`",Seals & Gaskets,15.00
HOSE TOP SYLPHY,Miscellaneous,35.00
HOSE LOW SYLPHY,Miscellaneous,35.00
WP HOSE SYLPHY,Miscellaneous,32.00
HEATER HOSE SYLPHY,Miscellaneous,38.00
OIL COOLER HOSE P/SG (B),Miscellaneous,16.00
"CLUTCH PUMP LOW WAJA, GEN 2, PSN 13/16``",Uncategorized,38.00
ALT WIRA 1.5 75A/80A (NEW),Uncategorized,250.00
BY PASS HOSE ELANTRA MD (TO TTB),Miscellaneous,65.00
CON ROD BRG UNSER KF80 7K STD,Uncategorized,65.00
TIMING CHAIN KIT UNSER KF80,Uncategorized,170.00
FULL SET GSK UNSER 7K,Uncategorized,120.00
"FAN BELT TRITON 2.5, FRONTIER 13X865",Belts & Timing,15.00
FAN BELT 13X865,Belts & Timing,15.00
PLUG CABLE UNSER KF80,Ignition Components,38.00
FUEL FILTER UNSER 1.8,Filters,20.00
"OIL FILTER T/H, V99, TERRANO",Filters,10.00
DIST P/SG 12V (CARB),Uncategorized,180.00
ABS F/RH ALZA (GAS),Brake Components,130.00
WATER PUMP SYLPHY,Cooling System,125.00
ACV40 HEAD LAMP BULB,Exterior & Accessories,75.00
PWR STG HOSE B14,Miscellaneous,25.00
DRIVE SHAFT RH ALZA (LONG),Uncategorized,180.00
DRIVE SHAFT LH ALZA (SHORT),Uncategorized,180.00
WATER HOSE TOP C22,Miscellaneous,18.00
WATER HOSE LOW C22,Miscellaneous,20.00
"OIL SEAL RW KUN25 08`, KUN26 (OUT)",Seals & Gaskets,14.00
"CLUTCH PUMP LOW E1800, MAXI `P` 3/4``",Uncategorized,38.00
WATER JACKET 26MM,Uncategorized,2.00
D/S BOOT ALMERA (IN),Uncategorized,18.00
TIE ROD END AVANZA 1.3,Suspension & Mountings,125.00
BEARING FW AVANZA (O),Uncategorized,90.00
ABS LINK FRT AVANZA 03`,Brake Components,35.00
LONGSHAFT MTG AVANZA,Suspension & Mountings,75.00
COUPLING AVANZA (29.5X78),Uncategorized,45.00
BALL JOINT LOW SWA 06`,Suspension & Mountings,80.00
"ARM BUSH RR KE70, TT132 (C), AVANZA, KEMBARA",Suspension & Mountings,5.00
GEAR BOX NUT P/SG (18MM),Miscellaneous,5.00
WASHER 18MM (ALM),Miscellaneous,1.00
CRANKSHAFT SENSOR FRONTIER D22 (FLYWHEEL),Electrical Components,155.00
FAN BELT 13X815,Belts & Timing,13.00
WATER HOSE TOP P/SG 12V,Miscellaneous,15.00
WATER HOSE LOW P/SG,Miscellaneous,14.00
"BY PASS HOSE EXORA, PREVE, BLM FLX, SUPRIMA S (THERMOSTAT)",Cooling System,15.00
"WATER PUMP PIPE O RING GEN 2, PERSONA (SILICON)",Cooling System,5.00
"AIR FILTER LATIO, LIVINA , SYLPHY, ALMERA",Filters,25.00
"WHEEL BOLT P/SG, WIRA (LONG) M14 X 12 X 1.5 X55L",Miscellaneous,5.00
"THERMOSTAT WASHER GEN 2, BLM, PSN",Cooling System,2.00
FAN BELT CRV 2.0 ALT,Belts & Timing,26.00
"FUEL FILTER FRONTIER D22, E25 URVAN 3.0 (LONG)",Filters,45.00
FUEL FILTER FRONTIER D22 (SHORT),Filters,32.00
"ATF OIL WS TOYOTA 4 LITRES ACV40, ASV50, NCP93, NCP150, ALTIS ZZE142,GGH20, MARK-X GRX120, GUN125",Engine Oils & Fluids,135.00
WIPER BLADE 21`` AXIA,Exterior & Accessories,12.00
WIPER BLADE 16``,Exterior & Accessories,10.00
"OIL FILTER PROTON X70, PASSAT 1.4,1.8, 2.0, AUDI 1.8 2.0, GOLF 5/6 1.8,2.0, V/W GTI (H14W30 HENGST, OC456 MAHLE, W719/45 MANN)",Filters,28.00
"OXYGEN SENSOR VIVA 1.0, MYVI 1.0/1.3 (LONG)",Electrical Components,100.00
DRIVE SHAFT LH KANCIL (SHORT),Uncategorized,135.00
OIL SEAL D/S KANCIL RH,Seals & Gaskets,15.00
OIL SEAL D/S KANCIL LH,Seals & Gaskets,15.00
"ENG MTG RR LATIO, LIVINA, SYLPHY 2.0",Uncategorized,150.00
"DUAL PUMP SYSTEM FLUID HONDA CRV DPSF-II 1 LITRES SWA,TOA",Uncategorized,55.00
WIPER TANK CAP MAZDA3,Exterior & Accessories,40.00
HEAD LAMP BULB ACV40,Exterior & Accessories,75.00
"OIL SEAL D/S KLS, KNR, MYVI, VIVA, ALZA (RH)",Seals & Gaskets,12.00
"OXYGEN SENSOR WIRA VDO, WAJA, GEN 2, PSN, BLM (SHORT WIRE)",Electrical Components,110.00
"DRIVE SHAFT LH KNR, KLS, VIVA (SHORT)",Uncategorized,150.00
WATER JACKET 30MM,Uncategorized,2.00
"BY PASS HOSE KLS, KNR (LONG)",Miscellaneous,25.00
RACK END VIVA,Uncategorized,22.00
"OIL SEAL D/S ALMERA, LIVINA, LATIO, T31, TEANA J32 L33, NV200, C26, SYLPHY",Seals & Gaskets,22.00
"OIL SEAL D/S B13, B14, N16, Y10, A32, BLM (MTM)",Seals & Gaskets,22.00
"WATER HOSE LOW GEN 2, PERSONA, BLM (ATM) PW826194",Miscellaneous,30.00
DISC PAD FRT NAVARA D40T,Brake Components,130.00
"OIL SEAL D/S VIOS NCP42, NCP93 LH (VITON)",Seals & Gaskets,22.00
"OIL SEAL D/S AE80, AE101, VIOS NCP42, NCP93 (RH)",Seals & Gaskets,20.00
"BRAKE PUMP F/RH CANTER FE434, FE639 1 1/4`` (ADJ)",Brake Components,45.00
"SPRING BUSH RR LN106, LH80 (S) NYLON",Suspension & Mountings,7.00
BRAKE FLUID DOT 4 (SMALL),Engine Oils & Fluids,10.00
"DRIVE SHAFT RH MYVI LB 1.5 11`, BEZZA 1.3 (LONG)",Uncategorized,170.00
"VALVE COVER GSK PSN CPS, WAJA CPS, EXORA CPS (SQUARE)",Seals & Gaskets,50.00
"BRAKE PUMP RR BLM, SAVVY 11/16``",Brake Components,20.00
"WATER PUMP KLS, KNR, VIVA, MYVI 1.0",Cooling System,80.00
"PLUG O RING VIVA, MYVI 1.0, ALTIS",Uncategorized,6.00
"VALVE COVER GSK MYVI 1.0, VIVA 1.0 850",Seals & Gaskets,28.00
OIL SEAL FLY V57 (VITON),Seals & Gaskets,55.00
WHEEL BOLT F/LH V58,Miscellaneous,15.00
OIL SEAL MAIN V57 (LH),Seals & Gaskets,16.00
"WATER PUMP B13, B14, C23 1.6, Y10",Cooling System,70.00
BRAKE PUMP F/RH YU41 1 1/8`` (ADJ),Brake Components,58.00
BRAKE PUMP R/LH HICOM MTB150DX 1``,Brake Components,50.00
"OIL SEAL RW NPR, HICOM 4.3 OUT",Seals & Gaskets,12.00
OIL SEAL BLM FLX (ATM CONVERTER),Seals & Gaskets,20.00
FORTE 1.6 6SPD DRIVE SHAFT LH,Uncategorized,260.00
FUEL TANK UNSER,Uncategorized,530.00
"LONGSHAFT MTG KUN25, INNOVA",Suspension & Mountings,80.00
WATER PUMP PIPE B14,Cooling System,50.00
TOP SET SV4 CARBON,Uncategorized,160.00
PVC VALVE BUSH LASER,Suspension & Mountings,5.00
"FAN BELT LATIO 1.8, LIVINA 1.8, SYLPHY 2.0 (6PK1205)",Belts & Timing,75.00
WIPER TANK MOTOR WAJA,Exterior & Accessories,17.00
BEARING,Uncategorized,15.00
THERMOSTAT HOUSING UNSER KF80,Cooling System,95.00
"AUTO FILTER SET ACR30, ACU30, ACV30, ACV41, MCU15, MCR30, MNH10",Uncategorized,45.00
"OIL SEAL D/S ACR30, ACV30, ACR50 RH",Seals & Gaskets,26.00
"OIL SEAL D/S ACR30, ACV30, ACR50 LH",Seals & Gaskets,26.00
PLUG O RING WAJA,Uncategorized,6.00
BLACK TAPE,Uncategorized,2.00
"WATER PUMP PIPE NAZA RIA, CARNIVAL (BIG LONG)",Cooling System,50.00
WATER HOSE TOP NAZA RIA,Miscellaneous,24.00
"ABS F/RH FORTE 1.6, 2.0 54661-1M000",Brake Components,155.00
"ABS F/LH FORTE 1.6, 2.0 (2H000)",Brake Components,155.00
ABS COVER FRT FORTE,Brake Components,25.00
TIMING KIT SET WIRA 1.6,Uncategorized,165.00
FAN BELT P/SG (P/STG) 13X575,Belts & Timing,12.00
FAN BELT 12.5 X 750,Belts & Timing,13.00
FUEL FILTER HINO DUTRO 300 (23304-78090),Filters,35.00
"*NEW PRICE* ATF OIL HYUNDAI SP-IV 1 LITRE (6 SPEED) FORTE, SANTAFE 11`, SONATA YF, TUCSON 13` SORENTO 2.4",Engine Oils & Fluids,48.00
"CRANKSHAFT PULLEY P/SG 12V, VDO (NO RUBBER)",Miscellaneous,65.00
FAN BELT 9.5X900,Belts & Timing,12.00
"WATER PUMP PIPE O RING SM4, SV4, S10",Cooling System,6.00
CLIP WIPER PANEL WIRA (LONG),Exterior & Accessories,1.00
"UPPER ARM LH KUN25, GUN125, FORTUNER TGN51 (6 MONTHS WARRANTY)",Suspension & Mountings,150.00
*NEW PRICE* ATF OIL MAZDA FZ 1 LITER (SKY ACTIVE ENGINE),Engine Oils & Fluids,50.00
OIL SEAL FLY NHR (VITON),Seals & Gaskets,60.00
DISC PAD RR N16 1.8,Brake Components,75.00
"AUTO FILTER SET WAJA, BLM, GEN 2, EXORA",Uncategorized,40.00
"ABS LINK FRT WAJA, GEN 2, PSN",Brake Components,20.00
WHITE TAPE,Uncategorized,1.50
BY PASS HOSE RIA 0K55W-13690,Miscellaneous,15.00
BY PASS HOSE RIA 0K566-15181,Miscellaneous,16.00
WATER PUMP PIPE NAZA RIA (0K566-15-18XA),Cooling System,43.00
BY PASS HOSE RIA (LONG) 80025-61B14,Miscellaneous,40.00
BEARING RW WIRA,Uncategorized,65.00
PWR WINDOW GEAR R/RH WIRA 01` (SQUARE),Uncategorized,40.00
PWR WINDOW MOTOR RH WIRA 02` (SQUARE),Uncategorized,40.00
PWR WINDOW SWITCH WIRA (MAIN) (PW539247),Electrical Components,55.00
"BODY PUMP P/SG, WIRA, GEN 2, PERSONA, BLM",Uncategorized,55.00
CABIN FILTER ALMERA,Filters,20.00
"DISC PAD FRT ACR30 01`, MCR30 01`, HARRIER 98` SXU10 MCU10",Brake Components,75.00
"SPARK PLUG ALTIS 10` 1.8, WISH ZRE142 ZRE172, MYVI 17` D20N, BEZZA 1.3, ARUZ, NSP151 (SC16HR11)",Ignition Components,180.00
"BEARING FLY PJR , HONDA",Uncategorized,13.00
"DISC ROTOR FRT WAJA 1.6, PDN, V6",Brake Components,170.00
OIL SEAL CLUTCH SM4,Seals & Gaskets,15.00
OIL SEAL GEAR LEVEL HONDA,Seals & Gaskets,14.00
PW812473 CLUTCH PUMP TUBE,Uncategorized,95.00
