DESCRIPTION,CATEGORY,U/PRICE
"FUEL FILTER NPR PRO 4JJ1, 4HK1 (PAPER)",Filters,28.00
"OIL SEAL D/S SR4, SM4, SO4,TMO (LH)",Seals & Gaskets,17.00
"OIL SEAL D/S S9A, SWA, S7A, TMO, T2A, TAO (RH)",Seals & Gaskets,22.00
STG RACK BUSH ALTIS ZZE121 RH,Suspension & Mountings,20.00
"OUTPUT SENSOR WAJA, GEN 2, EXORA, PSN, BLM (FOR CPS ENG)",Electrical Components,110.00
PLUG IN FUSE 20A,Uncategorized,1.00
"CLUTCH PUMP TOP SR4, SO4 5/8``",Uncategorized,68.00
"ACC PEDAL KUN25, INNOVA, FORTUNER",Uncategorized,300.00
WATER PUMP TRP,Cooling System,125.00
"TIMING KIT SET TROOPER 4ZC1 , 4ZD1",Uncategorized,170.00
ENG OIL HONDA 0W20 SP 4 LITRES (FULLY SYNTHETIC),Engine Oils & Fluids,175.00
T/LID HANDLE RANGER (BLACK),Exterior & Accessories,48.00
BRAKE FLUID DOT 4 BOSCH 1 LITRE,Engine Oils & Fluids,23.00
"GREASE CAP WIRA, FLX (50MM)",Miscellaneous,6.00
FAN BELT MYVI 1.3 LB 11` (4PK1630),Belts & Timing,38.00
"VALVE COVER HOSE KLS, KNR (LONG) --> AIR FILTER",Filters,15.00
D/S BOOT WIRA 1.6 (IN),Uncategorized,15.00
"DISC PAD RR X-TRAIL T30 T32, TEANA J32, L33L, SERENA C24 C26L, MURANO Z50 Z51",Brake Components,65.00
"WIPER BLADE RR 12`` ALZA,AXIA,INNOVA,ACR50",Exterior & Accessories,16.00
BUMPER RR SV4 96~98,Uncategorized,190.00
"BRAKE PUMP F/RH V99, V58 1 1/4`` (NO ADJ)",Brake Components,50.00
"BRAKE PUMP F/LH V99, V58 1 1/4`` (ADJ)",Brake Components,50.00
"BRAKE PUMP F/LH V99, V58 1 1/4`` (NO ADJ)",Brake Components,50.00
"OIL FILTER SAFARI, CABSTAR",Filters,15.00
"ARM R/RH WIRA 1.6, WAJA, GEN 2, PSN, PREVE (B)",Suspension & Mountings,50.00
"ARM R/LH WIRA 1.6, WAJA, GEN 2, PSN, PREVE (B)",Suspension & Mountings,50.00
COIL SPRING RUBBER WIRA RR 1 1/2``,Suspension & Mountings,8.00
"BRAKE SWITCH AXIA, BEZZA, MYVI D20N, ALZA 12`, ARUZ, ATIVA ( 4PIN )",Brake Components,35.00
"OIL SEAL CAM KLS, KNR, VIVA/ BLM FLX (ATM CONVERTER)",Seals & Gaskets,18.00
WATER PUMP WAJA 1.6,Cooling System,68.00
FAN BELT 13X825,Belts & Timing,14.00
GEAR LEVEL CABLE C22 PICKUP (RH) REV,Uncategorized,100.00
WIPER ARM LH WIRA,Suspension & Mountings,20.00
PWR WINDOW GEAR F/RH WIRA (TIGA SEGI),Uncategorized,38.00
STAB BUSH FRT P/SG (14MM),Suspension & Mountings,2.00
ABS RR TUCSON KYB,Brake Components,140.00
ABS COVER FRT SONATA YF,Brake Components,35.00
"SPARE TANK NPR, HICOM 4.3",Uncategorized,50.00
"STAB BUSH FRT S9A, S7A (27MM)",Suspension & Mountings,10.00
"ABS BUSH RR SR4, SO4, S10",Brake Components,7.00
"STAB BUSH LH GSR50, MHH10, GGH20",Suspension & Mountings,30.00
AUTO FILTER SET GUN125,Uncategorized,85.00
"D/S BOOT VIOS NCP42, NCP93 (IN)",Uncategorized,15.00
"D/S BOOT AE92, ALTIS (OUT)",Uncategorized,14.00
"AIR FILTER NHR, NPR, YU41, HICOM 4.3",Filters,28.00
"SUSP ROD KIT PAJERO, TRP",Uncategorized,8.00
SPRING BUMPER FRT PAJERO (LOW),Suspension & Mountings,25.00
BALL JOINT LOW PAJERO L049,Suspension & Mountings,40.00
"C.V.JOINT PJR V6, STORM (25X56X28)",Suspension & Mountings,120.00
"TIE ROD END PJR V6, STORM (OUT)",Suspension & Mountings,85.00
UPPER ARM PAJERO,Suspension & Mountings,170.00
COPPER WASHER 11MM,Miscellaneous,1.00
"OIL SEAL ATM SEL, TMO, T9A, S10, SWA, SDA, TAO, SNA, HRV T7A (RH LINE)",Seals & Gaskets,28.00
ABS LINK RR TUCSON,Brake Components,38.00
STAB BUSH RR TUCSON,Suspension & Mountings,12.00
"V-TEC O RING SNA 1.8, TAO, SWA, HRV, SMA, T7A",Uncategorized,35.00
STARTER SUBARU IMPREZA,Uncategorized,380.00
"STAB BUSH FRT TUCSON IX35 2.0 2.4 10-14`, SPORTAGE SL 10-14`",Suspension & Mountings,30.00
ABS LINK F/LH GETZ,Brake Components,38.00
"ATM GSK VIOS, ALTIS",Uncategorized,42.00
"DISC PAD FRT VIOS NCP93, YARIS, ALZA 13` (DRUM)",Brake Components,105.00
GEAR LEVEL BUSH KANCIL (RUBBER),Suspension & Mountings,8.00
"WIPER BLADE BLM, SYLPHY, MYVI LB",Exterior & Accessories,20.00
"OIL SEAL D/S KLS, KNR, MYVI, VIVA, ALZA, AXIA RH",Seals & Gaskets,25.00
"OIL FILTER NAVARA D40T, D23, E26 NV350",Filters,16.00
OIL FILTER CANTER 4D31,Filters,14.00
"OIL FILTER TROOPER, CANTER 4X4",Filters,16.00
"OIL SEAL CAM AE80,EE80, AE101 // MYVI 1.3, ALZA, AVANZA 1.3 1.5, RUSH=TIMING (VITON)",Seals & Gaskets,15.00
"D/S BOOT MYVI LB, ALZA, LIVINA (IN)",Uncategorized,15.00
"COUPLING PRADO, HZJ45 (32X92) UJ-234 MT",Uncategorized,45.00
"OIL SEAL TIMING P/SG, GEN 2",Seals & Gaskets,12.00
OIL SEAL CAM GEN 2,Seals & Gaskets,15.00
CYL HEAD HOUSING PIPE M9 (L-SHAPE),Miscellaneous,12.00
"DRIVE SHAFT RH WAJA, GEN 2 (LONG)",Uncategorized,170.00
OIL SEAL TIMING FRONTIER (VITON),Seals & Gaskets,24.00
WATER JACKET 40MM,Uncategorized,2.00
"CLUTCH DISC FRONTIER, NAVARA, HICOM, D-MAX 10``",Uncategorized,290.00
BEARING CLUTCH FRONTIER D22,Uncategorized,78.00
OIL FILTER FRONTIER D22,Filters,15.00
BOLT M8X25,Miscellaneous,2.00
FAN BELT TRITON 2.5,Belts & Timing,65.00
"TIE ROD END KUN25, FORTUNER TGN51",Suspension & Mountings,115.00
"BALL JOINT TOP KUN25, INNOVA, GUN125",Suspension & Mountings,68.00
STG RACK MAXI,Uncategorized,190.00
"ABS MTG FRT ALTIS 98`-07` ZZE121 ZZE122, WISH ZNE10 ANE10",Brake Components,70.00
"OIL SEAL FLY SM4, SO4, SX8",Seals & Gaskets,35.00
"BEARING RW MYVI D20N 17` , BEZZA 17'",Uncategorized,150.00
"CAP SEAL KANCIL, KLS, VIVA 850",Seals & Gaskets,10.00
"CLUTCH PUMP LOW KM36, UNSER, YH80 13/16``",Uncategorized,35.00
"AIR FILTER LH80, RUSA, UNSER, LY100 (17801-54070, 17801-05020)",Filters,18.00
"BEARING CLUTCH 3L, LN106, LH113",Uncategorized,60.00
"BRAKE SHOE RR LATIO 1.8, LIVINA 1.6, 1.8",Brake Components,85.00
"FAN BELT LATIO 1.6, LIVINA 1.6, NV200 (7PK1140)",Belts & Timing,70.00
"OIL PUMP O RING KANCIL, KLS, KNR, VIVA, MYVI 1.0",Uncategorized,10.00
DIST KANCIL (NEW),Uncategorized,150.00
"OIL PAN GSK CRV S10, SR4 T/C B16A",Uncategorized,25.00
AXLE NUT RR V99,Suspension & Mountings,18.00
"BEARING FW V57, V99 (INNER), NHR RW",Uncategorized,52.00
ABS SENSOR F/RH EXORA,Brake Components,95.00
"BY PASS HOSE GEN 2, PSN, BLM, FLX, NEO (LONG)",Miscellaneous,23.00
VALVE COVER GSK FRONTIER D22,Seals & Gaskets,28.00
TIMING COVER GSK FRONTIER (RUBBER),Seals & Gaskets,25.00
FUEL HOSE 5MM,Miscellaneous,2.50
DRAG LINK HICOM MTB140 28``,Uncategorized,160.00
DISC ROTOR FRT SWIFT 04` 1.5 RS415,Brake Components,161.00
09.A185.11 PG 408 1.6 FRT DISC ROTOR,Brake Components,138.00
08.A858.17 PG408 1.6 RR DISC ROTOR,Brake Components,351.00
L54005 DOT 4 BRAKE FLUID 500ML,Engine Oils & Fluids,14.85
FUEL TANK HOSE WIRA (B),Miscellaneous,20.00
OIL SEAL KIT FW WIRA,Seals & Gaskets,10.00
"BEARING FW LATIO, LIVINA",Uncategorized,150.00
"LOWER ARM RH LATIO, LIVINA, SYLPHY (6 MONTHS WARRANTY)",Suspension & Mountings,120.00
WATER HOSE TOP HICOM 4.3,Miscellaneous,26.00
WATER HOSE LOW HICOM 4.3,Miscellaneous,28.00
WATER PUMP HOSE HICOM 4.3,Cooling System,16.00
DOOR GLASS R/RH MYVI LB,Exterior & Accessories,85.00
BEARING G.BOX,Uncategorized,28.00
OIL SEAL MAIN KBR DVVT (VITON),Seals & Gaskets,18.00
"BEARING CLUTCH KBR, RUSA, G100, AVANZA, VIVA 660 850",Uncategorized,58.00
